{
  "record_version": 1,
  "id": "pd-1751884800001-b2c3d4e5",
  "created_at": "2026-07-07T12:00:01Z",
  "raw": false,
  "fingerprints": {
    "alg": "hmac-sha256",
    "prompt": "fedcba9876543210fedcba9876543210fedcba9876543210fedcba9876543210",
    "rewrite": null
  },
  "prompt_redacted": "Refactor the login handler. My credential is [REDACTED:api-key].",
  "prompt_raw": null,
  "parent_id": null,
  "report": {
    "report_version": 1,
    "created_at": "2026-07-07T12:00:01Z",
    "knowledge": {
      "knowledge_version": "2026.07-draft",
      "provider": "anthropic",
      "rubric_version": "2026.07-draft"
    },
    "event": null,
    "ir": {
      "ir_version": 1,
      "segments": [
        {
          "id": "s1",
          "kind": "task",
          "text": "Refactor the login handler. My credential is sk-EXAMPLENOTAREALKEY0000.",
          "note": null
        }
      ],
      "unsegmented_remainder": true
    },
    "findings": [
      {
        "id": "f1",
        "dimension": "R2",
        "severity": "medium",
        "evidence": [{ "segment": "s1", "quote": "Refactor the login handler." }],
        "explanation": "The prompt states a task but not its audience or purpose.",
        "fix": "State who the refactor is for and what it should preserve."
      }
    ],
    "estimates": null,
    "rewrite": null
  }
}
